{
  "schema_version": "1.0",
  "artifact_kind": "pooleos_native_kernel_virtual_memory_contract",
  "contract_id": "PKVM3",
  "selected_move_id": "N9-VM-DIRECT-MAP-001",
  "status": "complete_profile_pmm_owned_sparse_direct_map_with_generation_retirement",
  "production_ready": false,
  "production_promotion_allowed": false,
  "development_profile": {
    "feature": "development-active-virtual-memory",
    "selector": 10,
    "cpu_model": "qemu64",
    "bsp_only": true,
    "interrupts_disabled": true,
    "terminal": "halt"
  },
  "limits": {
    "paging_levels": 4,
    "max_direct_page_tables": 512,
    "max_direct_directory_tables": 4,
    "max_direct_map_ranges": 288,
    "page_bytes": 4096,
    "implemented_user_pages": 1,
    "cr3_writes": 2,
    "active_local_invalidations": 3,
    "active_processors": 1
  },
  "layout": {
    "canonical_address_bits": 48,
    "null_guard_end": "0x0000000000010000",
    "user_end_exclusive": "0x0000800000000000",
    "kernel_start": "0xFFFF800000000000",
    "direct_map_start": "0xFFFF900000000000",
    "direct_map_end_exclusive": "0xFFFFD00000000000",
    "temporary_map_start": "0xFFFFFFFF801F6000",
    "temporary_map_end_exclusive": "0xFFFFFFFF801F7000",
    "kernel_image_start": "0xFFFFFFFF80000000",
    "kernel_image_end_exclusive": "0xFFFFFFFFC0000000",
    "implemented_user_window_start": "0x0000000040000000",
    "direct_map_formula": "DIRECT_MAP_START + physical_address",
    "candidate_root_changes": [
      "PML4[0] private user hierarchy",
      "PML4[288] PMM-derived sparse supervisor direct map"
    ],
    "candidate_root_inheritance": "all other PML4 entries exactly equal the retained PKMAP2 root"
  },
  "table_policy": {
    "manifest_authority": "PKPMM7 reconstructs every free extent plus active non-release-excluded allocation and revalidates the exact manifest after table allocation",
    "coverage": "every PMM-admitted page in the selector-10 lifecycle and no unowned, held, firmware, device, loader-retained, metadata-retained, or ACPI-snapshot-retained page",
    "sparse_topology": "one leaf table per occupied 2 MiB physical region and one directory table per occupied 1 GiB region, bounded by the development-profile maxima",
    "table_frames": "one contiguous DMA32 generation-owned PKPMM7 allocation sized from the manifest topology",
    "data_frames": "one contiguous following DMA32 generation-owned PKPMM7 page",
    "table_order": [
      "PML4",
      "user PDPT",
      "user PD",
      "user PT",
      "direct PDPT",
      "sorted direct directories",
      "sorted direct leaf tables"
    ],
    "physical_address_width": "live BSP CPUID leaf 0x80000008 constrained to 36..52 bits",
    "materialization": "volatile writes through one PKMAP2 bootstrap temporary leaf with translation readback and per-transition INVLPG",
    "retained_mappings": "kernel image, exact guarded stack, and immutable handoff inherited and independently walked before activation",
    "temporary_alias": "shared inherited PKMAP2 leaf revoked and translation-checked immediately before activation",
    "direct_map_permissions": "supervisor writable NX write-back 4 KiB leaves for every manifest-admitted page",
    "cache_alias_policy": "PWT or PCD on any audited direct leaf is rejected; inherited retained aliases are excluded from direct-map coverage",
    "user_initial_permissions": "user writable NX write-back 4 KiB leaf",
    "user_protected_permissions": "user read/execute write-back 4 KiB leaf",
    "writable_executable_allowed": false,
    "large_pages_allowed": false,
    "occupied_direct_root_slot_allowed": false
  },
  "transaction_policy": {
    "allocation_retention": "exclusive non-copyable table and data owners acquired atomically after candidate audit; conflicts rejected before table writes; ordinary copied-handle frees reject in prepared, active and restored states; failed cleanup retains ownership",
    "candidate_audit_before_activation": true,
    "manifest_revalidation_after_allocation": true,
    "cr3_precondition": "IF clear, BSP id 0, exact retained original CR3",
    "activation": "write candidate CR3 and require exact readback",
    "activation_failure": "write exact original CR3 and require exact rollback readback",
    "active_table_access": "only through candidate direct-map virtual addresses",
    "architectural_accessed_dirty_bits": "admitted as the only hardware-mutated leaf bits and preserved across protect",
    "protect_receipt": "local INVLPG after exact user RW/NX to RX commit",
    "user_unmap_receipt": "local INVLPG after exact user leaf revocation",
    "direct_unmap_receipt": "local INVLPG after exact data direct-alias revocation",
    "frame_reuse": "forbidden until user and direct unmap receipts bind root generation, BSP id, sequence, and virtual address",
    "generation_retirement": "restoring the original root mints one exact root-generation/BSP/local-context-flush receipt only for the one-processor profile",
    "future_smp_dependency": "any active-processor count other than one is rejected as ShootdownRequired; no remote shootdown is executed or claimed",
    "release": "table reclamation requires the exact retirement receipt, zero remote dependencies, inactive readback, complete table scrub, temporary-alias revocation, and PMM generation release",
    "smp_shootdown_executed": false
  },
  "threat_model": {
    "protected_assets": [
      "executing kernel image",
      "current guarded BSP stack",
      "immutable PBP1 handoff",
      "complete PMM ownership coverage",
      "retained and forbidden physical holes",
      "single cache policy per mapped frame",
      "candidate table ownership",
      "data-frame reuse safety",
      "exact original CR3"
    ],
    "rejected_inputs": [
      "wrong or stale PMM generation",
      "forged or stale direct-map manifest",
      "overlapping ownership",
      "manifest capacity overflow",
      "noncontiguous allocation",
      "occupied direct-map PML4 slot",
      "large-page collision",
      "retained mapping or permission drift",
      "incompatible PWT or PCD cache alias",
      "present temporary alias at activation boundary",
      "wrong CPU",
      "IF enabled",
      "wrong active CR3",
      "unexpected PTE bits other than Accessed/Dirty",
      "failed write/readback",
      "stale, absent, or reordered invalidation/retirement receipt",
      "unimplemented multi-processor retirement"
    ],
    "fault_controls": [
      "activation readback mismatch with exact rollback",
      "active PTE write failure with exact rollback and no receipt",
      "wrong root, CPU, and interrupt state rejection",
      "occupied direct slot rejection",
      "forged manifest rejection",
      "retained-hole translation rejection",
      "cache-attribute drift rejection",
      "premature data reuse rejection",
      "missing and stale generation-retirement receipt rejection",
      "future SMP shootdown dependency rejection"
    ],
    "trusted_for_this_profile": [
      "single qemu64 BSP",
      "validated PKENTRY1 and PKMAP2 retained mappings",
      "PKPMM7 ownership ledger integrity",
      "coherent write-back RAM",
      "architectural MOV CR3 and INVLPG semantics",
      "interrupts remain disabled"
    ],
    "out_of_scope": [
      "AP startup",
      "inter-processor shootdown execution",
      "concurrent allocation",
      "PCID",
      "global mappings",
      "ring 3 execution",
      "user-fault delivery",
      "pager",
      "heap",
      "MMIO/PAT/MTRR qualification",
      "target hardware"
    ]
  },
  "qualification": {
    "qemu_run_count": 2,
    "fresh_ovmf_vars_each_run": true,
    "exact_markers_frame_and_pbp1_required": true,
    "independent_pbp1_ownership_manifest_oracle_required": true,
    "rust_manifest_sparse_hole_cache_rollback_and_retirement_tests_required": true,
    "negative_control_count": 48
  },
  "required_negative_controls": [
    "NEG-N9-PKVM3-MARKER-OMISSION",
    "NEG-N9-PKVM3-MARKER-ORDER",
    "NEG-N9-PKVM3-MARKER-DUPLICATE",
    "NEG-N9-PKVM3-SELECTOR",
    "NEG-N9-PKVM3-CONTRACT",
    "NEG-N9-PKVM3-TOPOLOGY",
    "NEG-N9-PKVM3-ORIGINAL-ROOT",
    "NEG-N9-PKVM3-CANDIDATE-ALIGNMENT",
    "NEG-N9-PKVM3-TABLE-GENERATION",
    "NEG-N9-PKVM3-DATA-CONTIGUITY",
    "NEG-N9-PKVM3-DATA-GENERATION",
    "NEG-N9-PKVM3-DIRECT-FIRST",
    "NEG-N9-PKVM3-DIRECT-LAST",
    "NEG-N9-PKVM3-DIRECT-GENERATION",
    "NEG-N9-PKVM3-DIRECT-RANGES",
    "NEG-N9-PKVM3-MAPPED-PAGES",
    "NEG-N9-PKVM3-GAP-PAGES",
    "NEG-N9-PKVM3-RETAINED-EXCLUSION",
    "NEG-N9-PKVM3-COVERAGE-CHECKSUM",
    "NEG-N9-PKVM3-CACHE-POLICY",
    "NEG-N9-PKVM3-CACHE-ALIAS",
    "NEG-N9-PKVM3-INHERITED-KERNEL",
    "NEG-N9-PKVM3-GUARDED-STACK",
    "NEG-N9-PKVM3-HANDOFF",
    "NEG-N9-PKVM3-BOOTSTRAP-REVOCATION",
    "NEG-N9-PKVM3-PRE-ACTIVE-STATE",
    "NEG-N9-PKVM3-CR3-WRITES",
    "NEG-N9-PKVM3-CANDIDATE-READBACK",
    "NEG-N9-PKVM3-ORIGINAL-RESTORE",
    "NEG-N9-PKVM3-ROLLBACK-CONTROL",
    "NEG-N9-PKVM3-BSP",
    "NEG-N9-PKVM3-ACTIVATION-SMP",
    "NEG-N9-PKVM3-LOCAL-INVLPG",
    "NEG-N9-PKVM3-ACTIVE-RECEIPTS",
    "NEG-N9-PKVM3-PROBE",
    "NEG-N9-PKVM3-LEAF-MUTATIONS",
    "NEG-N9-PKVM3-RETIREMENT-RECEIPT",
    "NEG-N9-PKVM3-CONTEXT-FLUSH",
    "NEG-N9-PKVM3-REMOTE-PENDING",
    "NEG-N9-PKVM3-FUTURE-SMP",
    "NEG-N9-PKVM3-DEFERRED-RECLAIM",
    "NEG-N9-PKVM3-EXACT-RELEASE",
    "NEG-N9-PKVM3-PHYSICAL-WRITES",
    "NEG-N9-PKVM3-TEMPORARY-MAPPING",
    "NEG-N9-PKVM3-OVERCLAIM",
    "NEG-N9-PKVM3-PBP1-BINDING",
    "NEG-N9-PKVM3-RETAINED-FREE-COUNT",
    "NEG-N9-PKVM3-RETAINED-FREE-MISSING"
  ],
  "claims": {
    "canonical_48_bit_layout_frozen": true,
    "kernel_stack_and_handoff_mappings_inherited_exactly": true,
    "live_pmm_generation_bound_table_and_data_frames": true,
    "kernel_complete_candidate_root_materialized": true,
    "complete_profile_pmm_ownership_direct_map_activated": true,
    "sparse_holes_and_retained_ranges_unmapped": true,